id,episode_id,number,raw_text,timestamp_in_ms,speaking_line,character_id,location_id,raw_character_text,raw_location_text,spoken_words,normalized_text,word_count
10256,34,262,Martin Prince: This is the stuff dreams are made of.,928000,true,38,396,Martin Prince,The Android's Dungeon & Baseball Card Shop,This is the stuff dreams are made of.,this is the stuff dreams are made of,8
10257,34,263,Milhouse Van Houten: It smells like my grandpa.,932000,true,25,396,Milhouse Van Houten,The Android's Dungeon & Baseball Card Shop,It smells like my grandpa.,it smells like my grandpa,5
10258,34,264,"Bart Simpson: Uh-oh, looks like rain. We better get this baby home.",934000,true,8,396,Bart Simpson,The Android's Dungeon & Baseball Card Shop,"Uh-oh, looks like rain. We better get this baby home.",uh-oh looks like rain we better get this baby home,10
10259,34,265,Bart Simpson: Uh-oh.,939000,true,8,396,Bart Simpson,The Android's Dungeon & Baseball Card Shop,Uh-oh.,uh-oh,1
10260,34,266,Dealer: Looks like you bought more than you bargained for.,940000,true,488,396,Dealer,The Android's Dungeon & Baseball Card Shop,Looks like you bought more than you bargained for.,looks like you bought more than you bargained for,9
10261,34,267,(Bart's Treehouse: int. tree house - a little later),954000,false,,84,,Bart's Treehouse,,,
10262,34,268,Radioactive Man: My pants... caught on barbed wire... Good Lord Choke... an A-bomb!,954000,true,484,84,Radioactive Man,Bart's Treehouse,My pants... caught on barbed wire... Good Lord Choke... an A-bomb!,my pants caught on barbed wire good lord choke an a-bomb,11
10263,34,269,Radioactive Man: Yaarrgh!,961000,true,484,84,Radioactive Man,Bart's Treehouse,Yaarrgh!,yaarrgh,1
10264,34,270,"Radioactive Man: I'm becoming radioactive. From this day forward, I shall call myself Radioactive Man.",966000,true,484,84,Radioactive Man,Bart's Treehouse,"I'm becoming radioactive. From this day forward, I shall call myself Radioactive Man.",im becoming radioactive from this day forward i shall call myself radioactive man,13
10265,34,271,Milhouse Van Houten: (HUSHED) So that's how it happened!,975000,true,25,84,Milhouse Van Houten,Bart's Treehouse,So that's how it happened!,so thats how it happened,5
10266,34,272,Martin Prince: I would've thought being hit by an atomic bomb would have killed him.,977000,true,38,84,Martin Prince,Bart's Treehouse,I would've thought being hit by an atomic bomb would have killed him.,i wouldve thought being hit by an atomic bomb would have killed him,13
10267,34,273,Bart Simpson: Now you know better.,981000,true,8,84,Bart Simpson,Bart's Treehouse,Now you know better.,now you know better,4
10268,34,274,"Milhouse Van Houten: Turn the page, Bart.",982000,true,25,84,Milhouse Van Houten,Bart's Treehouse,"Turn the page, Bart.",turn the page bart,4
10269,34,275,"Bart Simpson: Listen, you guys are welcome to come over and read it any time you like.",992000,true,8,84,Bart Simpson,Bart's Treehouse,"Listen, you guys are welcome to come over and read it any time you like.",listen you guys are welcome to come over and read it any time you like,15
10270,34,276,Milhouse Van Houten: Why can't we keep it at my house?,995000,true,25,84,Milhouse Van Houten,Bart's Treehouse,Why can't we keep it at my house?,why cant we keep it at my house,8
10271,34,277,Bart Simpson: Your house? That's crazy talk!,996000,true,8,84,Bart Simpson,Bart's Treehouse,Your house? That's crazy talk!,your house thats crazy talk,5
10272,34,278,"Milhouse Van Houten: Well, the comic's ours as much as it is yours.",998000,true,25,84,Milhouse Van Houten,Bart's Treehouse,"Well, the comic's ours as much as it is yours.",well the comics ours as much as it is yours,10
10273,34,279,"Martin Prince: How about this, guys. Bart can have it Mondays and Thursdays. Milhouse will get it Tuesdays and Fridays. And yours truly will take it Wednesdays and Saturdays.",1000000,true,38,84,Martin Prince,Bart's Treehouse,"How about this, guys. Bart can have it Mondays and Thursdays. Milhouse will get it Tuesdays and Fridays. And yours truly will take it Wednesdays and Saturdays.",how about this guys bart can have it mondays and thursdays milhouse will get it tuesdays and fridays and yours truly will take it wednesdays and saturdays,27
10274,34,280,Bart Simpson: Perfect.,1008000,true,8,84,Bart Simpson,Bart's Treehouse,Perfect.,perfect,1
10275,34,281,Milhouse Van Houten: Wait a minute. What about Sunday?,1009000,true,25,84,Milhouse Van Houten,Bart's Treehouse,Wait a minute. What about Sunday?,wait a minute what about sunday,6
10276,34,282,Bart Simpson: Yeah. What about Sunday?,1011000,true,8,84,Bart Simpson,Bart's Treehouse,Yeah. What about Sunday?,yeah what about sunday,4
10277,34,283,"Martin Prince: Well, Sunday possession will be determined by a random number generator. I will take the digits one through three. Milhouse will have four through six. And Bart will have seven through nine.",1013000,true,38,84,Martin Prince,Bart's Treehouse,"Well, Sunday possession will be determined by a random number generator. I will take the digits one through three. Milhouse will have four through six. And Bart will have seven through nine.",well sunday possession will be determined by a random number generator i will take the digits one through three milhouse will have four through six and bart will have seven through nine,32
10278,34,284,Bart Simpson: Perfect.,1017000,true,8,84,Bart Simpson,Bart's Treehouse,Perfect.,perfect,1
10279,34,285,Milhouse Van Houten: Wait a minute. What about zero?,1023000,true,25,84,Milhouse Van Houten,Bart's Treehouse,Wait a minute. What about zero?,wait a minute what about zero,6
10280,34,286,Bart Simpson: Yeah! What about zero?,1026000,true,8,84,Bart Simpson,Bart's Treehouse,Yeah! What about zero?,yeah what about zero,4
10281,34,287,Milhouse Van Houten: Yeah.,1028000,true,25,84,Milhouse Van Houten,Bart's Treehouse,Yeah.,yeah,1
10282,34,288,"Martin Prince: Well, in the unlikely event of a zero, possession will be determined by ""Rock, Scissor, Paper"" competition. Best three out of five, how's that?",1028000,true,38,84,Martin Prince,Bart's Treehouse,"Well, in the unlikely event of a zero, possession will be determined by ""Rock, Scissor, Paper"" competition. Best three out of five, how's that?",well in the unlikely event of a zero possession will be determined by rock scissor paper competition best three out of five hows that,24
10283,34,289,"Martin Prince: Excellent! Well, today being Saturday, Gentlemen, I guess I'll be taking my comic and...",1037000,true,38,84,Martin Prince,Bart's Treehouse,"Excellent! Well, today being Saturday, Gentlemen, I guess I'll be taking my comic and...",excellent well today being saturday gentlemen i guess ill be taking my comic and,14
10284,34,290,"Bart Simpson: (MENACINGLY) Uh, uh, uh, ah nice try, Martin. It almost worked. But tonight, this comic book stays right here.",1042000,true,8,84,Bart Simpson,Bart's Treehouse,"Uh, uh, uh, ah nice try, Martin. It almost worked. But tonight, this comic book stays right here.",uh uh uh ah nice try martin it almost worked but tonight this comic book stays right here,18
10285,34,291,"Martin Prince: If the comic book stays right here, then so do I.",1049000,true,38,84,Martin Prince,Bart's Treehouse,"If the comic book stays right here, then so do I.",if the comic book stays right here then so do i,11
10286,34,292,Milhouse Van Houten: Me too!,1051000,true,25,84,Milhouse Van Houten,Bart's Treehouse,Me too!,me too,2
10287,34,293,"Bart Simpson: Fine. We're all going to stay here with the comic book. It'll be like a sleep-over. Yeah, a sleep-over. That's what pals do, right? Real friendly-like.",1052000,true,8,84,Bart Simpson,Bart's Treehouse,"Fine. We're all going to stay here with the comic book. It'll be like a sleep-over. Yeah, a sleep-over. That's what pals do, right? Real friendly-like.",fine were all going to stay here with the comic book itll be like a sleep-over yeah a sleep-over thats what pals do right real friendly-like,26
10288,34,294,Milhouse Van Houten: I want to read it again.,1067000,true,25,84,Milhouse Van Houten,Bart's Treehouse,I want to read it again.,i want to read it again,6
10289,34,295,"Bart Simpson: Nice try, mister.",1069000,true,8,84,Bart Simpson,Bart's Treehouse,"Nice try, mister.",nice try mister,3
10290,34,296,"Martin Prince: Milhouse, the acids in your hands could damage the newsprint. We want to keep this comic forever, so the last one alive will have the honor of being buried with it.",1070000,true,38,84,Martin Prince,Bart's Treehouse,"Milhouse, the acids in your hands could damage the newsprint. We want to keep this comic forever, so the last one alive will have the honor of being buried with it.",milhouse the acids in your hands could damage the newsprint we want to keep this comic forever so the last one alive will have the honor of being buried with it,31
10291,34,297,"Bart Simpson: (SUSPICIOUSLY) What do you mean, the last one alive?",1080000,true,8,84,Bart Simpson,Bart's Treehouse,"What do you mean, the last one alive?",what do you mean the last one alive,8
10292,34,298,Martin Prince: I meant years from now.,1083000,true,38,84,Martin Prince,Bart's Treehouse,I meant years from now.,i meant years from now,5
10293,34,299,"Bart Simpson: Yeah, sure you did.",1084000,true,8,84,Bart Simpson,Bart's Treehouse,"Yeah, sure you did.",yeah sure you did,4
10294,34,300,"Milhouse Van Houten: Bart, don't push him!",1085000,true,25,84,Milhouse Van Houten,Bart's Treehouse,"Bart, don't push him!",bart dont push him,4
10295,34,301,"Bart Simpson: I knew it. You're both against me! Well, nobody makes a sap out of Bartholemew J. Simpson.",1087000,true,8,84,Bart Simpson,Bart's Treehouse,"I knew it. You're both against me! Well, nobody makes a sap out of Bartholemew J. Simpson.",i knew it youre both against me well nobody makes a sap out of bartholemew j simpson,17
10296,34,302,Marge Simpson: I thought you boys might like some milk and microwave s'mores.,1102000,true,1,84,Marge Simpson,Bart's Treehouse,I thought you boys might like some milk and microwave s'mores.,i thought you boys might like some milk and microwave smores,11
10297,34,303,"Milhouse Van Houten: (GASPING FOR AIR) Thank you, Mrs. Simpson.",1107000,true,25,84,Milhouse Van Houten,Bart's Treehouse,"Thank you, Mrs. Simpson.",thank you mrs simpson,4
10298,34,304,"Bart Simpson: Sweet dreams, boys.",1110000,true,8,84,Bart Simpson,Bart's Treehouse,"Sweet dreams, boys.",sweet dreams boys,3
10299,34,305,(Simpson Home: ext. simpson house - back yard - night),1128000,false,,5,,Simpson Home,,,
10300,34,306,(Bart's Treehouse: int. tree house - late at night),1128000,false,,84,,Bart's Treehouse,,,
10301,34,307,Bart Simpson: One more step and you're a dead man.,1128000,true,8,84,Bart Simpson,Bart's Treehouse,One more step and you're a dead man.,one more step and youre a dead man,8
10302,34,308,"Martin Prince: I have to go to the bathroom, Bart.",1131000,true,38,84,Martin Prince,Bart's Treehouse,"I have to go to the bathroom, Bart.",i have to go to the bathroom bart,8
10303,34,309,"Bart Simpson: Yeah, right, so do I, but you don't see me gettin' up.",1133000,true,8,84,Bart Simpson,Bart's Treehouse,"Yeah, right, so do I, but you don't see me gettin' up.",yeah right so do i but you dont see me gettin up,12
10304,34,310,"Milhouse Van Houten: Hey, what's going on?",1135000,true,25,84,Milhouse Van Houten,Bart's Treehouse,"Hey, what's going on?",hey whats going on,4
10305,34,311,Bart Simpson: Our dear friend Martin was trying to steal the comic book.,1137000,true,8,84,Bart Simpson,Bart's Treehouse,Our dear friend Martin was trying to steal the comic book.,our dear friend martin was trying to steal the comic book,11
10306,34,312,Milhouse Van Houten: Let's tie him up!,1140000,true,25,84,Milhouse Van Houten,Bart's Treehouse,Let's tie him up!,lets tie him up,4
10307,34,313,"Martin Prince: Bart, is this how you treat all your guests?",1144000,true,38,84,Martin Prince,Bart's Treehouse,"Bart, is this how you treat all your guests?",bart is this how you treat all your guests,9
10392,35,53,"Bart Simpson: Hmp, impressive.",284000,true,8,5,Bart Simpson,Simpson Home,"Hmp, impressive.",hmp impressive,2
10308,34,314,"Bart Simpson: Quiet, Piggy, or we'll stick an apple in your mouth. (TO MILHOUSE) We can't take any chances. We'll have to take turns watching him.",1145000,true,8,84,Bart Simpson,Bart's Treehouse,"Quiet, Piggy, or we'll stick an apple in your mouth. We can't take any chances. We'll have to take turns watching him.",quiet piggy or well stick an apple in your mouth we cant take any chances well have to take turns watching him,22
10309,34,315,Milhouse Van Houten: Okay. I'll go first.,1149000,true,25,84,Milhouse Van Houten,Bart's Treehouse,Okay. I'll go first.,okay ill go first,4
10310,34,316,"Bart Simpson: Oh, so that's your little game. Let old Bart get nice and drowsy, then, when his back is turned... wham!",1152000,true,8,84,Bart Simpson,Bart's Treehouse,"Oh, so that's your little game. Let old Bart get nice and drowsy, then, when his back is turned... wham!",oh so thats your little game let old bart get nice and drowsy then when his back is turned wham,20
10311,34,317,"Bart Simpson: Well, it is not going to happen, see?",1159000,true,8,84,Bart Simpson,Bart's Treehouse,"Well, it is not going to happen, see?",well it is not going to happen see,8
10312,34,318,"Milhouse Van Houten: You're going crazy, Bart. I'm telling your mom!",1161000,true,25,84,Milhouse Van Houten,Bart's Treehouse,"You're going crazy, Bart. I'm telling your mom!",youre going crazy bart im telling your mom,8
10313,34,319,"Bart Simpson: Hey Martin, tell him what we do with squealers.",1164000,true,8,84,Bart Simpson,Bart's Treehouse,"Hey Martin, tell him what we do with squealers.",hey martin tell him what we do with squealers,9
10314,34,320,Martin Prince: I don't know. Is it worse than what you do with people that have to go to the bathroom?,1165000,true,38,84,Martin Prince,Bart's Treehouse,I don't know. Is it worse than what you do with people that have to go to the bathroom?,i dont know is it worse than what you do with people that have to go to the bathroom,19
10315,34,321,Milhouse Van Houten: (TO BART) You can't stop me.,1169000,true,25,84,Milhouse Van Houten,Bart's Treehouse,You can't stop me.,you cant stop me,4
10316,34,322,Bart Simpson: The hell I can't!,1170000,true,8,84,Bart Simpson,Bart's Treehouse,The hell I can't!,the hell i cant,4
10317,34,323,(Simpson Home: int. simpson house - living room),1176000,false,,5,,Simpson Home,,,
10318,34,324,"Marge Simpson: Homer, it's really coming down. Could you check on the boys?",1176000,true,1,5,Marge Simpson,Simpson Home,"Homer, it's really coming down. Could you check on the boys?",homer its really coming down could you check on the boys,11
10319,34,325,Homer Simpson: They're fine.,1183000,true,2,5,Homer Simpson,Simpson Home,They're fine.,theyre fine,2
10320,34,326,(Bart's Treehouse: int. tree house - continuous),1193000,false,,84,,Bart's Treehouse,,,
10321,34,327,"Martin Prince: Bart, the comic!",1193000,true,38,84,Martin Prince,Bart's Treehouse,"Bart, the comic!",bart the comic,3
10322,34,328,Milhouse Van Houten: Don't let go of me Bart!,1196000,true,25,84,Milhouse Van Houten,Bart's Treehouse,Don't let go of me Bart!,dont let go of me bart,6
10323,34,329,"Bart Simpson: Milhouse, it's not that far to the ground. And the rain has probably softened it up a bit.",1198000,true,8,84,Bart Simpson,Bart's Treehouse,"Milhouse, it's not that far to the ground. And the rain has probably softened it up a bit.",milhouse its not that far to the ground and the rain has probably softened it up a bit,18
10324,34,330,"Milhouse Van Houten: No, Bart! No!",1204000,true,25,84,Milhouse Van Houten,Bart's Treehouse,"No, Bart! No!",no bart no,3
10325,34,331,"Martin Prince: (SMUGLY) You know, if you guys hadn't tied me up, I could be saving the comic as we speak.",1208000,true,38,84,Martin Prince,Bart's Treehouse,"You know, if you guys hadn't tied me up, I could be saving the comic as we speak.",you know if you guys hadnt tied me up i could be saving the comic as we speak,18
10326,34,332,Bart Simpson: Shut up! Shut up!,1212000,true,8,84,Bart Simpson,Bart's Treehouse,Shut up! Shut up!,shut up shut up,4
10327,34,333,"Milhouse Van Houten: Help me, Bart! I didn't even want the comic. I wanted Carl Yastrzemski with the big side-burns.",1214000,true,25,84,Milhouse Van Houten,Bart's Treehouse,"Help me, Bart! I didn't even want the comic. I wanted Carl Yastrzemski with the big side-burns.",help me bart i didnt even want the comic i wanted carl yastrzemski with the big side-burns,17
10328,34,334,"Marge Simpson: Boys, you better come in the house. You don't want to get the sniffles.",1245000,true,1,84,Marge Simpson,Bart's Treehouse,"Boys, you better come in the house. You don't want to get the sniffles.",boys you better come in the house you dont want to get the sniffles,14
10329,34,335,"Bart Simpson: Aw, Mom.",1250000,true,8,84,Bart Simpson,Bart's Treehouse,"Aw, Mom.",aw mom,2
10330,34,336,Marge Simpson: Now come on... (LOOKING AT MARTIN) You can play your little tie-up game inside. I've got some cocoa on the stove. Who wants imitation marshmallows?,1251000,true,1,84,Marge Simpson,Bart's Treehouse,Now come on... You can play your little tie-up game inside. I've got some cocoa on the stove. Who wants imitation marshmallows?,now come on you can play your little tie-up game inside ive got some cocoa on the stove who wants imitation marshmallows,22
10331,34,337,"Martin Prince: I'd raise my hand, Mrs. Simpson, if I could.",1261000,true,38,84,Martin Prince,Bart's Treehouse,"I'd raise my hand, Mrs. Simpson, if I could.",id raise my hand mrs simpson if i could,9
10332,34,338,(Simpson Home: ext. simpson house - the next morning),1273000,false,,5,,Simpson Home,,,
10333,34,339,Homer Simpson: (ANNOYED GRUNT),1273000,false,2,5,Homer Simpson,Simpson Home,,,
10334,34,340,"Martin Prince: (SAD) It's no use, fellows. Another comic book has returned to the earth from whence it came.",1273000,true,38,5,Martin Prince,Simpson Home,"It's no use, fellows. Another comic book has returned to the earth from whence it came.",its no use fellows another comic book has returned to the earth from whence it came,16
10335,34,341,Bart Simpson: We worked so hard and now it's all gone... We ended up with nothing because the three of us can't share.,1280000,true,8,5,Bart Simpson,Simpson Home,We worked so hard and now it's all gone... We ended up with nothing because the three of us can't share.,we worked so hard and now its all gone we ended up with nothing because the three of us cant share,21
10336,34,342,Milhouse Van Houten: What's your point?,1287000,true,25,5,Milhouse Van Houten,Simpson Home,What's your point?,whats your point,3
10337,34,343,Bart Simpson: Nothing. It just kind of ticks me off.,1289000,true,8,5,Bart Simpson,Simpson Home,Nothing. It just kind of ticks me off.,nothing it just kind of ticks me off,8
10338,34,344,"Radioactive Man: Well, the world is safe again... but for how long?",1296000,true,484,5,Radioactive Man,Simpson Home,"Well, the world is safe again... but for how long?",well the world is safe again but for how long,10
10339,35,0,(HILL NEAR NUCLEAR POWER PLANT: ext. hill near nuclear power plant - morning),68000,false,,397,,HILL NEAR NUCLEAR POWER PLANT,,,
10340,35,1,"Mayor Joe Quimby: Ah, Chief Wiggum, Archbishop McGee, distinguished guests. I am pleased to dedicate this emergency warning system. In the uh, off chance of a nuclear disaster, this sign will tell you, the good citizens of Springfield, what to do.",68000,true,240,397,Mayor Joe Quimby,HILL NEAR NUCLEAR POWER PLANT,"Ah, Chief Wiggum, Archbishop McGee, distinguished guests. I am pleased to dedicate this emergency warning system. In the uh, off chance of a nuclear disaster, this sign will tell you, the good citizens of Springfield, what to do.",ah chief wiggum archbishop mcgee distinguished guests i am pleased to dedicate this emergency warning system in the uh off chance of a nuclear disaster this sign will tell you the good citizens of springfield what to do,38
10341,35,2,"Homer Simpson: (CHUCKLING) Joke's on them. If the core explodes, there won't be any power to light that sign. (LAUGH)",111000,true,2,397,Homer Simpson,HILL NEAR NUCLEAR POWER PLANT,"Joke's on them. If the core explodes, there won't be any power to light that sign.",jokes on them if the core explodes there wont be any power to light that sign,16
10342,35,3,"Mayor Joe Quimby: And now, I would like to present the man who made this sign possible, by dropping the last of his obstructionist legal challenges... Montgomery Burns.",119000,true,240,397,Mayor Joe Quimby,HILL NEAR NUCLEAR POWER PLANT,"And now, I would like to present the man who made this sign possible, by dropping the last of his obstructionist legal challenges... Montgomery Burns.",and now i would like to present the man who made this sign possible by dropping the last of his obstructionist legal challenges montgomery burns,25
10343,35,4,Waylon Smithers: Mr. Burns is never late. Something must be terribly wrong.,132000,true,14,397,Waylon Smithers,HILL NEAR NUCLEAR POWER PLANT,Mr. Burns is never late. Something must be terribly wrong.,mr burns is never late something must be terribly wrong,10
10344,35,5,"Mayor Joe Quimby: Well, there better be. Nobody leaves Diamond Joe Quimby holding the bag!",135000,true,240,397,Mayor Joe Quimby,HILL NEAR NUCLEAR POWER PLANT,"Well, there better be. Nobody leaves Diamond Joe Quimby holding the bag!",well there better be nobody leaves diamond joe quimby holding the bag,12
10345,35,6,(Burns Manor: int. burns mansion - master bedroom - morning),139000,false,,53,,Burns Manor,,,
10346,35,7,C. Montgomery Burns: (GRUNTING) Must... turn... over. Got to... greet... dignitaries!,139000,true,15,53,C. Montgomery Burns,Burns Manor,Must... turn... over. Got to... greet... dignitaries!,must turn over got to greet dignitaries,7
10347,35,8,"Waylon Smithers: Oh, no, Mr. Burns! We've got to get a doctor!",145000,true,14,53,Waylon Smithers,Burns Manor,"Oh, no, Mr. Burns! We've got to get a doctor!",oh no mr burns weve got to get a doctor,10
10348,35,9,"C. Montgomery Burns: Absolutely not! No quack sawbones is going to apply his leeches to me! As long as there's an ounce of strength left in me, I...",149000,true,15,53,C. Montgomery Burns,Burns Manor,"Absolutely not! No quack sawbones is going to apply his leeches to me! As long as there's an ounce of strength left in me, I...",absolutely not no quack sawbones is going to apply his leeches to me as long as theres an ounce of strength left in me i,25
10349,35,10,Dr. Julius Hibbert: Mmmm. Mr. Burns is suffering from what we medical men call hypohemia. In layman's terms it's quite simply a lack of blood.,160000,true,332,53,Dr. Julius Hibbert,Burns Manor,Mmmm. Mr. Burns is suffering from what we medical men call hypohemia. In layman's terms it's quite simply a lack of blood.,mmmm mr burns is suffering from what we medical men call hypohemia in laymans terms its quite simply a lack of blood,22
10350,35,11,"Waylon Smithers: (ANXIOUSLY) Damn it, doctor, I'm no idiot! I know what hypohemia is. What I want to know is what can we do about it?",169000,true,14,53,Waylon Smithers,Burns Manor,"Damn it, doctor, I'm no idiot! I know what hypohemia is. What I want to know is what can we do about it?",damn it doctor im no idiot i know what hypohemia is what i want to know is what can we do about it,23
10351,35,12,"Dr. Julius Hibbert: Well, at this point, our only hope is a transfusion.",173000,true,332,53,Dr. Julius Hibbert,Burns Manor,"Well, at this point, our only hope is a transfusion.",well at this point our only hope is a transfusion,10
10352,35,13,Waylon Smithers: How long does it take to sterilize a needle?,176000,true,14,53,Waylon Smithers,Burns Manor,How long does it take to sterilize a needle?,how long does it take to sterilize a needle,9
10353,35,14,Dr. Julius Hibbert: A few seconds.,178000,true,332,53,Dr. Julius Hibbert,Burns Manor,A few seconds.,a few seconds,3
10354,35,15,"Waylon Smithers: Well, skip it.",178000,true,14,53,Waylon Smithers,Burns Manor,"Well, skip it.",well skip it,3
10355,35,16,Waylon Smithers: Just leave me enough to get home.,179000,true,14,53,Waylon Smithers,Burns Manor,Just leave me enough to get home.,just leave me enough to get home,7
10356,35,17,Dr. Julius Hibbert: (CHUCKLING) I'm afraid it's not that simple. His blood type is Double-O-Negative. It's quite rare.,181000,true,332,53,Dr. Julius Hibbert,Burns Manor,I'm afraid it's not that simple. His blood type is Double-O-Negative. It's quite rare.,im afraid its not that simple his blood type is double-o-negative its quite rare,14
10357,35,18,Waylon Smithers: (ANGUISHED MOAN) But I'm B positive. Damn this common gutter blood in my veins!,188000,true,14,53,Waylon Smithers,Burns Manor,But I'm B positive. Damn this common gutter blood in my veins!,but im b positive damn this common gutter blood in my veins,12
10358,35,19,"C. Montgomery Burns: (WEAKLY) Smithers, don't feel so bad. After all, that kidney you donated to me really hit the spot.",191000,true,15,53,C. Montgomery Burns,Burns Manor,"Smithers, don't feel so bad. After all, that kidney you donated to me really hit the spot.",smithers dont feel so bad after all that kidney you donated to me really hit the spot,17
10359,35,20,(Springfield Nuclear Power Plant: int. nuclear power plant - afternoon),199000,false,,10,,Springfield Nuclear Power Plant,,,
10393,35,54,Homer Simpson: How many hairs on my head? Without looking!,285000,true,2,5,Homer Simpson,Simpson Home,How many hairs on my head? Without looking!,how many hairs on my head without looking,8
10421,35,82,Waylon Smithers: (BRAVELY) Go ahead.,409000,true,14,297,Waylon Smithers,Hospital,Go ahead.,go ahead,2
76553,265,276,Chimp: (PLEASED GRUNTING),1079000,false,1371,2239,Chimp,CHIMP REFUGE,,,
