id,episode_id,number,raw_text,timestamp_in_ms,speaking_line,character_id,location_id,raw_character_text,raw_location_text,spoken_words,normalized_text,word_count
9549,32,209,"Miss Hoover: No, actually, it was a little of both. Sometimes when a disease is in all the magazines and all the news shows, it's only natural that you think you have it.",848000,true,464,3,Miss Hoover,Springfield Elementary School,"No, actually, it was a little of both. Sometimes when a disease is in all the magazines and all the news shows, it's only natural that you think you have it.",no actually it was a little of both sometimes when a disease is in all the magazines and all the news shows its only natural that you think you have it,31
9550,32,210,Lisa Simpson: (NEAR TEARS) Where's Mr. Bergstrom?,856000,true,9,3,Lisa Simpson,Springfield Elementary School,Where's Mr. Bergstrom?,wheres mr bergstrom,3
9551,32,211,Miss Hoover: I don't know. Although I'd sure like to talk to him. He didn't touch my lesson plan. What did he teach you?,856000,true,464,3,Miss Hoover,Springfield Elementary School,I don't know. Although I'd sure like to talk to him. He didn't touch my lesson plan. What did he teach you?,i dont know although id sure like to talk to him he didnt touch my lesson plan what did he teach you,22
9552,32,212,Lisa Simpson: That life is worth living.,864000,true,9,3,Lisa Simpson,Springfield Elementary School,That life is worth living.,that life is worth living,5
9553,32,213,"Edna Krabappel-Flanders: The polls will be open from now until the end of recess. Now, (SOUR) just in case any of you have decided to put any thought into this, we'll have our final statements. Martin?",864000,true,40,3,Edna Krabappel-Flanders,Springfield Elementary School,"The polls will be open from now until the end of recess. Now, just in case any of you have decided to put any thought into this, we'll have our final statements. Martin?",the polls will be open from now until the end of recess now just in case any of you have decided to put any thought into this well have our final statements martin,33
9554,32,214,Martin Prince: (HOARSE WHISPER) I don't think there's anything left to say.,877000,true,38,3,Martin Prince,Springfield Elementary School,I don't think there's anything left to say.,i dont think theres anything left to say,8
9555,32,215,Edna Krabappel-Flanders: Bart?,881000,true,40,3,Edna Krabappel-Flanders,Springfield Elementary School,Bart?,bart,1
9556,32,216,Bart Simpson: Victory party under the slide!,882000,true,8,3,Bart Simpson,Springfield Elementary School,Victory party under the slide!,victory party under the slide,5
9557,32,217,(Apartment Building: Ext. apartment building - day),889000,false,,374,,Apartment Building,,,
9558,32,218,Lisa Simpson: (CALLING) Mr. Bergstrom! Mr. Bergstrom!,889000,true,9,374,Lisa Simpson,Apartment Building,Mr. Bergstrom! Mr. Bergstrom!,mr bergstrom mr bergstrom,4
9559,32,219,"Landlady: Hey, hey, he Moved out this morning. He must have a new job -- he took his Copernicus costume.",893000,true,469,374,Landlady,Apartment Building,"Hey, hey, he Moved out this morning. He must have a new job -- he took his Copernicus costume.",hey hey he moved out this morning he must have a new job -- he took his copernicus costume,19
9560,32,220,Lisa Simpson: Do you know where I could find him?,898000,true,9,374,Lisa Simpson,Apartment Building,Do you know where I could find him?,do you know where i could find him,8
9561,32,221,Landlady: I think he's taking the next train to Capital City.,900000,true,469,374,Landlady,Apartment Building,I think he's taking the next train to Capital City.,i think hes taking the next train to capital city,10
9562,32,222,"Lisa Simpson: The train, how like him... traditional, yet environmentally sound.",903000,true,9,374,Lisa Simpson,Apartment Building,"The train, how like him... traditional, yet environmentally sound.",the train how like him traditional yet environmentally sound,9
9563,32,223,"Landlady: Yes, and it's been the backbone of our country since Leland Stanford drove that golden spike at Promontory point.",908000,true,469,374,Landlady,Apartment Building,"Yes, and it's been the backbone of our country since Leland Stanford drove that golden spike at Promontory point.",yes and its been the backbone of our country since leland stanford drove that golden spike at promontory point,19
9564,32,224,"Lisa Simpson: I see he touched you, too.",915000,true,9,374,Lisa Simpson,Apartment Building,"I see he touched you, too.",i see he touched you too,6
9565,32,225,(Springfield Elementary School: EXT. ELEMENTARY - SCHOOL PLAYGROUND - AFTERNOON),918000,false,,3,,Springfield Elementary School,,,
9566,32,226,"Bart Simpson: Hey, thanks for your vote, man.",918000,true,8,3,Bart Simpson,Springfield Elementary School,"Hey, thanks for your vote, man.",hey thanks for your vote man,6
9567,32,227,Nelson Muntz: I didn't vote. Voting's for geeks.,920000,true,101,3,Nelson Muntz,Springfield Elementary School,I didn't vote. Voting's for geeks.,i didnt vote votings for geeks,6
9568,32,228,"Bart Simpson: Well, you got that right. (TO TERRI AND SHERRI) Thanks for your vote, girls.",922000,true,8,3,Bart Simpson,Springfield Elementary School,"Well, you got that right. Thanks for your vote, girls.",well you got that right thanks for your vote girls,10
9569,32,229,Terri/sherri: We forgot.,925000,true,467,3,Terri/sherri,Springfield Elementary School,We forgot.,we forgot,2
9570,32,230,"Bart Simpson: Well, don't sweat it. Just so long as a couple of people did... right, Milhouse?",927000,true,8,3,Bart Simpson,Springfield Elementary School,"Well, don't sweat it. Just so long as a couple of people did... right, Milhouse?",well dont sweat it just so long as a couple of people did right milhouse,15
9571,32,231,Milhouse Van Houten: Uh oh.,930000,true,25,3,Milhouse Van Houten,Springfield Elementary School,Uh oh.,uh oh,2
9572,32,232,Bart Simpson: Lewis?,931000,true,8,3,Bart Simpson,Springfield Elementary School,Lewis?,lewis,1
9573,32,233,Bart Simpson: (LOUDER) Somebody must have voted.,932000,true,8,3,Bart Simpson,Springfield Elementary School,Somebody must have voted.,somebody must have voted,4
9574,32,234,"Milhouse Van Houten: What about you, Bart? Didn't you vote?",933000,true,25,3,Milhouse Van Houten,Springfield Elementary School,"What about you, Bart? Didn't you vote?",what about you bart didnt you vote,7
9575,32,235,Bart Simpson: Uh oh.,936000,true,8,3,Bart Simpson,Springfield Elementary School,Uh oh.,uh oh,2
9576,32,236,Bart Simpson: (ANGUISHED SCREAM),936000,false,8,3,Bart Simpson,Springfield Elementary School,,,
9577,32,237,Wendell Borton: Yayyyyyyyyyyyyyy!,943000,true,53,3,Wendell Borton,Springfield Elementary School,Yayyyyyyyyyyyyyy!,yayyyyyyyyyyyyyy,1
75766,263,106,(Moe's Tavern: Int. Moe's - evening),497000,false,,15,,Moe's Tavern,,,
9578,32,238,Bart Simpson: (TO MRS. KRABAPPEL) I demand a recount.,943000,true,8,3,Bart Simpson,Springfield Elementary School,I demand a recount.,i demand a recount,4
9579,32,239,"Edna Krabappel-Flanders: One for Martin, two for Martin. Would you like another recount?",946000,true,40,3,Edna Krabappel-Flanders,Springfield Elementary School,"One for Martin, two for Martin. Would you like another recount?",one for martin two for martin would you like another recount,11
9580,32,240,Bart Simpson: (SADLY) No.,949000,true,8,3,Bart Simpson,Springfield Elementary School,No.,no,1
9581,32,241,"Edna Krabappel-Flanders: (RELISHING IT) Well, I just want to make sure. One for Martin. Two for Martin.",950000,true,40,3,Edna Krabappel-Flanders,Springfield Elementary School,"Well, I just want to make sure. One for Martin. Two for Martin.",well i just want to make sure one for martin two for martin,13
9582,32,242,"Kid Reporter: (TO MARTIN) This way, Mister President!",952000,true,470,3,Kid Reporter,Springfield Elementary School,"This way, Mister President!",this way mister president,4
9583,32,243,(Train Station: int. train station - afternoon),960000,false,,375,,Train Station,,,
9584,32,244,"Conductor: Now boarding on track 5, The afternoon delight coming to Shelbyville, Parkville, and…..",960000,true,41,375,Conductor,Train Station,"Now boarding on track 5, The afternoon delight coming to Shelbyville, Parkville, and…..",now boarding on track 5 the afternoon delight coming to shelbyville parkville and,13
9585,32,245,"Lisa Simpson: Mr. Bergstrom! Hey, Mr. Bergstrom!",963000,true,9,375,Lisa Simpson,Train Station,"Mr. Bergstrom! Hey, Mr. Bergstrom!",mr bergstrom hey mr bergstrom,5
9586,32,246,"BERGSTROM: Hey, Lisa.",967000,true,465,375,BERGSTROM,Train Station,"Hey, Lisa.",hey lisa,2
9587,32,247,"Lisa Simpson: Hey, Lisa, indeed.",970000,true,9,375,Lisa Simpson,Train Station,"Hey, Lisa, indeed.",hey lisa indeed,3
9588,32,248,BERGSTROM: What? What is it?,971000,true,465,375,BERGSTROM,Train Station,What? What is it?,what what is it,4
9589,32,249,"Lisa Simpson: Oh, I mean, were you just going to leave, just like that?",973000,true,9,375,Lisa Simpson,Train Station,"Oh, I mean, were you just going to leave, just like that?",oh i mean were you just going to leave just like that,12
9590,32,250,"BERGSTROM: Ah, I'm sorry, Lisa. You know, it's the life of the substitute teacher: he's a fraud. Today he might be wearing gym shorts, tomorrow he's speaking French, or, or, or pretending to know how to run a band saw, or God knows what.",979000,true,465,375,BERGSTROM,Train Station,"Ah, I'm sorry, Lisa. You know, it's the life of the substitute teacher: he's a fraud. Today he might be wearing gym shorts, tomorrow he's speaking French, or, or, or pretending to know how to run a band saw, or God knows what.",ah im sorry lisa you know its the life of the substitute teacher hes a fraud today he might be wearing gym shorts tomorrow hes speaking french or or or pretending to know how to run a band saw or god knows what,43
9591,32,251,Lisa Simpson: You can't go! You're the best teacher I'll ever have.,993000,true,9,375,Lisa Simpson,Train Station,You can't go! You're the best teacher I'll ever have.,you cant go youre the best teacher ill ever have,10
9592,32,252,"BERGSTROM: Ah, that's not true. Other teachers will come along who...",996000,true,465,375,BERGSTROM,Train Station,"Ah, that's not true. Other teachers will come along who...",ah thats not true other teachers will come along who,10
9593,32,253,"Lisa Simpson: Oh, please.",999000,true,9,375,Lisa Simpson,Train Station,"Oh, please.",oh please,2
9594,32,254,"BERGSTROM: No, I can't lie to you, I am the best. But, you know, they need me over in the projects of Capital City.",1000000,true,465,375,BERGSTROM,Train Station,"No, I can't lie to you, I am the best. But, you know, they need me over in the projects of Capital City.",no i cant lie to you i am the best but you know they need me over in the projects of capital city,23
9595,32,255,Lisa Simpson: But I need you too.,1005000,true,9,375,Lisa Simpson,Train Station,But I need you too.,but i need you too,5
9596,32,256,BERGSTROM: That's the problem with being middle class. Anybody who really cares will abandon you for those who need it more.,1007000,true,465,375,BERGSTROM,Train Station,That's the problem with being middle class. Anybody who really cares will abandon you for those who need it more.,thats the problem with being middle class anybody who really cares will abandon you for those who need it more,20
9597,32,257,"Lisa Simpson: (SNIFFLING) I, I understand. Mr. Bergstrom, I'm going to miss you.",1015000,true,9,375,Lisa Simpson,Train Station,"I, I understand. Mr. Bergstrom, I'm going to miss you.",i i understand mr bergstrom im going to miss you,10
9598,32,258,BERGSTROM: I'll tell you what...,1021000,true,465,375,BERGSTROM,Train Station,I'll tell you what...,ill tell you what,4
9599,32,259,"BERGSTROM: Whenever you feel like you're alone and there's nobody you can rely on, this is all you need to know.",1024000,true,465,375,BERGSTROM,Train Station,"Whenever you feel like you're alone and there's nobody you can rely on, this is all you need to know.",whenever you feel like youre alone and theres nobody you can rely on this is all you need to know,20
9600,32,260,"Lisa Simpson: (CHOKED UP) Thank you, Mr. Bergstrom.",1032000,true,9,375,Lisa Simpson,Train Station,"Thank you, Mr. Bergstrom.",thank you mr bergstrom,4
9601,32,261,Conductor: All aboard!,1034000,true,41,375,Conductor,Train Station,All aboard!,all aboard,2
9602,32,262,"Lisa Simpson: So, I guess this is it? It you don't mind I'll just run alongside the train as it speeds you from my life?",1036000,true,9,375,Lisa Simpson,Train Station,"So, I guess this is it? It you don't mind I'll just run alongside the train as it speeds you from my life?",so i guess this is it it you dont mind ill just run alongside the train as it speeds you from my life,23
9603,32,263,"BERGSTROM: Goodbye, Lisa honey. It'll be okay. Just read the note.",1057000,true,465,375,BERGSTROM,Train Station,"Goodbye, Lisa honey. It'll be okay. Just read the note.",goodbye lisa honey itll be okay just read the note,10
9604,32,264,(Simpson Home: INT. SIMPSON HOUSE - DINING ROOM - night),1070000,false,,5,,Simpson Home,,,
9660,33,5,Homer Simpson: (INDIGNANT) Never thrown a party? What about that big bash we had with all the champagne and musicians and holy men and everything?,97000,true,2,5,Homer Simpson,Simpson Home,Never thrown a party? What about that big bash we had with all the champagne and musicians and holy men and everything?,never thrown a party what about that big bash we had with all the champagne and musicians and holy men and everything,22
9605,32,265,"Homer Simpson: (MULLING IT OVER, LOW, TO HIMSELF) Bart didn't get one vote?! Oh, this is the worst thing that ever happened to us. (TRYING TO CONVINCE HIMSELF) Alright, allright, spilled milk, spilled milk, spilled milk. (NOTICING LISA) What are you so mopey about?",1070000,true,2,5,Homer Simpson,Simpson Home,"Bart didn't get one vote?! Oh, this is the worst thing that ever happened to us. Alright, allright, spilled milk, spilled milk, spilled milk. What are you so mopey about?",bart didnt get one vote oh this is the worst thing that ever happened to us alright allright spilled milk spilled milk spilled milk what are you so mopey about,30
9606,32,266,Lisa Simpson: Nothing.,1081000,true,9,5,Lisa Simpson,Simpson Home,Nothing.,nothing,1
9607,32,267,"Marge Simpson: Lisa, tell your father.",1082000,true,1,5,Marge Simpson,Simpson Home,"Lisa, tell your father.",lisa tell your father,4
9608,32,268,Lisa Simpson: Mr. Bergstrom left today.,1084000,true,9,5,Lisa Simpson,Simpson Home,Mr. Bergstrom left today.,mr bergstrom left today,4
9609,32,269,Homer Simpson: Oh.,1086000,true,2,5,Homer Simpson,Simpson Home,Oh.,oh,1
9610,32,270,Lisa Simpson: He's gone. Forever.,1087000,true,9,5,Lisa Simpson,Simpson Home,He's gone. Forever.,hes gone forever,3
9611,32,271,Homer Simpson: And?,1088000,true,2,5,Homer Simpson,Simpson Home,And?,and,1
9612,32,272,Lisa Simpson: I didn't think you'd understand.,1089000,true,9,5,Lisa Simpson,Simpson Home,I didn't think you'd understand.,i didnt think youd understand,5
9613,32,273,"Homer Simpson: Hey, just because I don't care doesn't mean I don't understand.",1091000,true,2,5,Homer Simpson,Simpson Home,"Hey, just because I don't care doesn't mean I don't understand.",hey just because i dont care doesnt mean i dont understand,11
9614,32,274,"Lisa Simpson: (FIGHTING BACK TEARS) I'm glad I'm not crying because I would hate for you to think that what I'm about to say is based on emotion. But you, sir, are a baboon!",1096000,true,9,5,Lisa Simpson,Simpson Home,"I'm glad I'm not crying because I would hate for you to think that what I'm about to say is based on emotion. But you, sir, are a baboon!",im glad im not crying because i would hate for you to think that what im about to say is based on emotion but you sir are a baboon,29
9615,32,275,Homer Simpson: (SHOCKED) Me?,1108000,true,2,5,Homer Simpson,Simpson Home,Me?,me,1
9616,32,276,"Lisa Simpson: Yes, you! Baboon, baboon, baboon, baboon!",1109000,true,9,5,Lisa Simpson,Simpson Home,"Yes, you! Baboon, baboon, baboon, baboon!",yes you baboon baboon baboon baboon,6
9617,32,277,Homer Simpson: I don't think you realize what you're saying.,1112000,true,2,5,Homer Simpson,Simpson Home,I don't think you realize what you're saying.,i dont think you realize what youre saying,8
9618,32,278,Lisa Simpson: Baboon!,1115000,true,9,5,Lisa Simpson,Simpson Home,Baboon!,baboon,1
9619,32,279,"Bart Simpson: Whoa, somebody was bound to say it one day. I just can't believe it was her.",1118000,true,8,5,Bart Simpson,Simpson Home,"Whoa, somebody was bound to say it one day. I just can't believe it was her.",whoa somebody was bound to say it one day i just cant believe it was her,16
9620,32,280,"Homer Simpson: (SHOCKED) Did you hear that, Marge? She called me a baboon! The stupidest, ugliest, smelliest ape of them all!",1123000,true,2,5,Homer Simpson,Simpson Home,"Did you hear that, Marge? She called me a baboon! The stupidest, ugliest, smelliest ape of them all!",did you hear that marge she called me a baboon the stupidest ugliest smelliest ape of them all,18
9621,32,281,"Marge Simpson: Homer, you are not allowed to have hurt feelings right now. There's a little girl upstairs who needs you. Her confidence in her father is shaken, and no little girl can be happy unless she has faith in her Daddy.",1129000,true,1,5,Marge Simpson,Simpson Home,"Homer, you are not allowed to have hurt feelings right now. There's a little girl upstairs who needs you. Her confidence in her father is shaken, and no little girl can be happy unless she has faith in her Daddy.",homer you are not allowed to have hurt feelings right now theres a little girl upstairs who needs you her confidence in her father is shaken and no little girl can be happy unless she has faith in her daddy,40
9622,32,282,Homer Simpson: (READING THE SIGN) Go Away.,1146000,true,2,5,Homer Simpson,Simpson Home,Go Away.,go away,2
9623,32,283,"Homer Simpson: Lisa, don't hold anything back. You can tell me. Are you crying because you called Daddy a baboon?",1146000,true,2,5,Homer Simpson,Simpson Home,"Lisa, don't hold anything back. You can tell me. Are you crying because you called Daddy a baboon?",lisa dont hold anything back you can tell me are you crying because you called daddy a baboon,18
9624,32,284,Lisa Simpson: No!,1158000,true,9,5,Lisa Simpson,Simpson Home,No!,no,1
9625,32,285,Homer Simpson: Nuts.,1159000,true,2,5,Homer Simpson,Simpson Home,Nuts.,nuts,1
9626,32,286,Homer Simpson: (ANNOYED GRUNT) This isn't going well at all.,1162000,true,2,5,Homer Simpson,Simpson Home,This isn't going well at all.,this isnt going well at all,6
9627,32,287,"Lisa Simpson: Look, if you just want me to forgive you --",1165000,true,9,5,Lisa Simpson,Simpson Home,"Look, if you just want me to forgive you --",look if you just want me to forgive you --,10
9628,32,288,"Homer Simpson: No, no, no. I just wish I knew what to say.",1165000,true,2,5,Homer Simpson,Simpson Home,"No, no, no. I just wish I knew what to say.",no no no i just wish i knew what to say,11
9629,32,289,"Homer Simpson: Although, maybe this will help. Now you lost someone special and it hurts. I'm lucky because I never lost anyone special to me. Everyone special to me is under this roof.",1172000,true,2,5,Homer Simpson,Simpson Home,"Although, maybe this will help. Now you lost someone special and it hurts. I'm lucky because I never lost anyone special to me. Everyone special to me is under this roof.",although maybe this will help now you lost someone special and it hurts im lucky because i never lost anyone special to me everyone special to me is under this roof,31
9630,32,290,Lisa Simpson: (MOANS),1172000,false,9,5,Lisa Simpson,Simpson Home,,,
9661,33,6,Marge Simpson: That was our wedding.,103000,true,1,5,Marge Simpson,Simpson Home,That was our wedding.,that was our wedding,4
9662,33,7,Homer Simpson: Oh.,103000,true,2,5,Homer Simpson,Simpson Home,Oh.,oh,1
9663,33,8,"Marge Simpson: (LOOKS UP) Children, it's time for you to go to bed.",105000,true,1,5,Marge Simpson,Simpson Home,"Children, it's time for you to go to bed.",children its time for you to go to bed,9
9631,32,291,"Homer Simpson: (PATS HER HEAD) It's true. Now, you'll have lots of special people in your life, Lisa. There's probably some place where they all get together, and the food is real good, and guys like me are serving drinks. (BEAT) Oh well, maybe I can't explain all this, but I can fix your doll house for you. At least, I'm good at monkey work. You know... monkey. You know what I mean?",1185000,true,2,5,Homer Simpson,Simpson Home,"It's true. Now, you'll have lots of special people in your life, Lisa. There's probably some place where they all get together, and the food is real good, and guys like me are serving drinks. Oh well, maybe I can't explain all this, but I can fix your doll house for you. At least, I'm good at monkey work. You know... monkey. You know what I mean?",its true now youll have lots of special people in your life lisa theres probably some place where they all get together and the food is real good and guys like me are serving drinks oh well maybe i cant explain all this but i can fix your doll house for you at least im good at monkey work you know monkey you know what i mean,67
9632,32,292,Lisa Simpson: Yeah.,1211000,true,9,5,Lisa Simpson,Simpson Home,Yeah.,yeah,1
9633,32,293,Homer Simpson: I can hold these nails in place with my tail.,1212000,true,2,5,Homer Simpson,Simpson Home,I can hold these nails in place with my tail.,i can hold these nails in place with my tail,10
9634,32,294,Lisa Simpson: You're so silly.,1220000,true,9,5,Lisa Simpson,Simpson Home,You're so silly.,youre so silly,3
9635,32,295,Homer Simpson: Gimme a banana.,1221000,true,2,5,Homer Simpson,Simpson Home,Gimme a banana.,gimme a banana,3
9636,32,296,Lisa Simpson: I don't have any banana.,1223000,true,9,5,Lisa Simpson,Simpson Home,I don't have any banana.,i dont have any banana,5
9637,32,297,"Homer Simpson: Come on, you're holding out on me.",1225000,true,2,5,Homer Simpson,Simpson Home,"Come on, you're holding out on me.",come on youre holding out on me,7
9638,32,298,"Lisa Simpson: I'm sorry I called you a baboon, Dad.",1232000,true,9,5,Lisa Simpson,Simpson Home,"I'm sorry I called you a baboon, Dad.",im sorry i called you a baboon dad,8
9639,32,299,Homer Simpson: Think nothing of it.,1233000,true,2,5,Homer Simpson,Simpson Home,Think nothing of it.,think nothing of it,4
9640,32,300,"Homer Simpson: Hey, what's the matter, son?",1242000,true,2,5,Homer Simpson,Simpson Home,"Hey, what's the matter, son?",hey whats the matter son,5
9641,32,301,"Bart Simpson: (SHAKING HEAD) Ah, Dad, if just me, Milhouse and Lewis had voted...",1245000,true,8,5,Bart Simpson,Simpson Home,"Ah, Dad, if just me, Milhouse and Lewis had voted...",ah dad if just me milhouse and lewis had voted,10
9642,32,302,"Homer Simpson: Hey son, would you have gotten any money for being class president?",1250000,true,2,5,Homer Simpson,Simpson Home,"Hey son, would you have gotten any money for being class president?",hey son would you have gotten any money for being class president,12
9643,32,303,Bart Simpson: No.,1255000,true,8,5,Bart Simpson,Simpson Home,No.,no,1
9644,32,304,Homer Simpson: Would you have to do extra work?,1256000,true,2,5,Homer Simpson,Simpson Home,Would you have to do extra work?,would you have to do extra work,7
9645,32,305,Bart Simpson: Yeah.,1257000,true,8,5,Bart Simpson,Simpson Home,Yeah.,yeah,1
9646,32,306,"Homer Simpson: And is this Martin guy going to get to do anything neat, like throw out the first ball at the world series, huh?",1258000,true,2,5,Homer Simpson,Simpson Home,"And is this Martin guy going to get to do anything neat, like throw out the first ball at the world series, huh?",and is this martin guy going to get to do anything neat like throw out the first ball at the world series huh,23
9647,32,307,"Bart Simpson: Well, no.",1264000,true,8,5,Bart Simpson,Simpson Home,"Well, no.",well no,2
9648,32,308,"Homer Simpson: So, let the baby have his bottle, huh? That's my motto.",1265000,true,2,5,Homer Simpson,Simpson Home,"So, let the baby have his bottle, huh? That's my motto.",so let the baby have his bottle huh thats my motto,11
9649,32,309,"Bart Simpson: (BRIGHTENING) Hey! Thanks, monkey-man.",1272000,true,8,5,Bart Simpson,Simpson Home,"Hey! Thanks, monkey-man.",hey thanks monkey-man,3
9650,32,310,Homer Simpson: Holy-moly... talk about parenting!,1276000,true,2,5,Homer Simpson,Simpson Home,Holy-moly... talk about parenting!,holy-moly talk about parenting,4
9651,32,311,Homer Simpson: Uh oh.,1282000,true,2,5,Homer Simpson,Simpson Home,Uh oh.,uh oh,2
9652,32,312,"Homer Simpson: Sleep well, Maggie. Ah, three for three.",1285000,true,2,5,Homer Simpson,Simpson Home,"Sleep well, Maggie. Ah, three for three.",sleep well maggie ah three for three,7
9653,32,313,"Marge Simpson: Homie, did you straighten everything out...?",1292000,true,1,5,Marge Simpson,Simpson Home,"Homie, did you straighten everything out...?",homie did you straighten everything out,6
9654,32,314,"Homer Simpson: (HAPPILY) Up... up... up... up... up... up. Don't say anything, Marge. Let's just go to bed. I'm on the biggest roll of my life.",1293000,true,2,5,Homer Simpson,Simpson Home,"Up... up... up... up... up... up. Don't say anything, Marge. Let's just go to bed. I'm on the biggest roll of my life.",up up up up up up dont say anything marge lets just go to bed im on the biggest roll of my life,23
9655,33,0,(Simpson Home: int. simpson house - living room - night),84000,false,,5,,Simpson Home,,,
9656,33,1,Homer Simpson: Mmm... hors doovers.,84000,true,2,5,Homer Simpson,Simpson Home,Mmm... hors doovers.,mmm hors doovers,3
9657,33,2,Marge Simpson: Homer! You promised!,84000,true,1,5,Marge Simpson,Simpson Home,Homer! You promised!,homer you promised,3
