id,episode_id,number,raw_text,timestamp_in_ms,speaking_line,character_id,location_id,raw_character_text,raw_location_text,spoken_words,normalized_text,word_count
10010,34,16,Lisa Simpson: Too bad we didn't come dressed as popular cartoon characters.,130000,true,9,387,Lisa Simpson,Springfield Convention Center,Too bad we didn't come dressed as popular cartoon characters.,too bad we didnt come dressed as popular cartoon characters,10
10011,34,17,Bart Simpson: This looks like a discount for...,134000,true,8,387,Bart Simpson,Springfield Convention Center,This looks like a discount for...,this looks like a discount for,6
10012,34,18,Bart Simpson: Bartman!,137000,true,8,387,Bart Simpson,Springfield Convention Center,Bartman!,bartman,1
10013,34,19,Ticket Seller: Who are you supposed to be?,140000,true,34,387,Ticket Seller,Springfield Convention Center,Who are you supposed to be?,who are you supposed to be,6
10014,34,20,Bart Simpson: (À LA MICHAEL KEATON) I'm Bartman!,142000,true,8,387,Bart Simpson,Springfield Convention Center,I'm Bartman!,im bartman,2
10015,34,21,Ticket Seller: Never heard of him. Full price.,144000,true,34,387,Ticket Seller,Springfield Convention Center,Never heard of him. Full price.,never heard of him full price,6
10016,34,22,Bart Simpson: (UNDER HIS BREATH) Lousy rip off...,146000,true,8,387,Bart Simpson,Springfield Convention Center,Lousy rip off...,lousy rip off,3
10017,34,23,"DIAMOND JOE: (KENNEDY VOICE) Is uh, this on?... Ahem, young people of Springfield: As your Mayor, I'd like to welcome you to our annual funny book convention, and thank you for pumping almost three hundred dollars into the local economy.",148000,true,482,387,DIAMOND JOE,Springfield Convention Center,"Is uh, this on?... Ahem, young people of Springfield: As your Mayor, I'd like to welcome you to our annual funny book convention, and thank you for pumping almost three hundred dollars into the local economy.",is uh this on ahem young people of springfield as your mayor id like to welcome you to our annual funny book convention and thank you for pumping almost three hundred dollars into the local economy,36
10018,34,24,DIAMOND JOE: Your youthful high spirits have imparted a glow to this old war-horse. (JOKING) You might say I feel like Radiation Man!,160000,true,482,387,DIAMOND JOE,Springfield Convention Center,Your youthful high spirits have imparted a glow to this old war-horse. You might say I feel like Radiation Man!,your youthful high spirits have imparted a glow to this old war-horse you might say i feel like radiation man,20
10019,34,25,"Jimbo Jones: That's Radioactive Man, jerk!",169000,true,144,387,Jimbo Jones,Springfield Convention Center,"That's Radioactive Man, jerk!",thats radioactive man jerk,4
10020,34,26,"DIAMOND JOE: I stand corrected... Well, have fun and be sure to clear out by six for the Shriners. (TO ASSISTANT) Get that punk's name. No one makes a fool out of Diamond Joe Quimby.",172000,true,482,387,DIAMOND JOE,Springfield Convention Center,"I stand corrected... Well, have fun and be sure to clear out by six for the Shriners. Get that punk's name. No one makes a fool out of Diamond Joe Quimby.",i stand corrected well have fun and be sure to clear out by six for the shriners get that punks name no one makes a fool out of diamond joe quimby,31
10021,34,27,"Martin Prince: Excuse me, sir. Has anyone turned in a left Vulcan ear?",182000,true,38,387,Martin Prince,Springfield Convention Center,"Excuse me, sir. Has anyone turned in a left Vulcan ear?",excuse me sir has anyone turned in a left vulcan ear,11
10080,34,86,Bart Simpson: Please Dad.,392000,true,8,388,Bart Simpson,Krusty Burger,Please Dad.,please dad,2
10022,34,28,"Lost And Found Guy: (RUMMAGING THROUGH BOX) Let's see, we've got a utility belt, a couple of tricorders, a light saber... Sorry, kid.",186000,true,483,387,Lost And Found Guy,Springfield Convention Center,"Let's see, we've got a utility belt, a couple of tricorders, a light saber... Sorry, kid.",lets see weve got a utility belt a couple of tricorders a light saber sorry kid,16
10023,34,29,"Otto Mann: Hey, Bart-dude!",193000,true,52,387,Otto Mann,Springfield Convention Center,"Hey, Bart-dude!",hey bart-dude,2
10024,34,30,"Bart Simpson: Hey, Otto-man! Oooh, what's that?",200000,true,8,387,Bart Simpson,Springfield Convention Center,"Hey, Otto-man! Oooh, what's that?",hey otto-man oooh whats that,5
10025,34,31,"Otto Mann: My very own idea for a comic book, little man. It's about a dude who drives a school bus by day, but by night, fights vampires in a post-apocalyptic warzone!",203000,true,52,387,Otto Mann,Springfield Convention Center,"My very own idea for a comic book, little man. It's about a dude who drives a school bus by day, but by night, fights vampires in a post-apocalyptic warzone!",my very own idea for a comic book little man its about a dude who drives a school bus by day but by night fights vampires in a post-apocalyptic warzone,30
10026,34,32,Bart Simpson: Cool!,213000,true,8,387,Bart Simpson,Springfield Convention Center,Cool!,cool,1
10027,34,33,"Milhouse Van Houten: C'mon, Bart. We're going to see Buddy Hodges.",214000,true,25,387,Milhouse Van Houten,Springfield Convention Center,"C'mon, Bart. We're going to see Buddy Hodges.",cmon bart were going to see buddy hodges,8
10028,34,34,Bart Simpson: The guy who played Fallout Boy on TV?,217000,true,8,387,Bart Simpson,Springfield Convention Center,The guy who played Fallout Boy on TV?,the guy who played fallout boy on tv,8
10029,34,35,Milhouse Van Houten: Yep.,217000,true,25,387,Milhouse Van Houten,Springfield Convention Center,Yep.,yep,1
10030,34,36,"Bart Simpson: Wow, I guess he wasn't killed in Vietnam.",220000,true,8,387,Bart Simpson,Springfield Convention Center,"Wow, I guess he wasn't killed in Vietnam.",wow i guess he wasnt killed in vietnam,8
10031,34,37,Radioactive Man: Aaahh... These Laramie cigarettes give me the steady nerves I need to combat evil.,223000,true,484,387,Radioactive Man,Springfield Convention Center,Aaahh... These Laramie cigarettes give me the steady nerves I need to combat evil.,aaahh these laramie cigarettes give me the steady nerves i need to combat evil,14
10032,34,38,"Fallout Boy: Gee whillikers, Radioactive Man. Wisht I was old enough to smoke Laramies.",230000,true,485,387,Fallout Boy,Springfield Convention Center,"Gee whillikers, Radioactive Man. Wisht I was old enough to smoke Laramies.",gee whillikers radioactive man wisht i was old enough to smoke laramies,12
10033,34,39,"Radioactive Man: Sorry, Fallout Boy, not until you're sixteen.",233000,true,484,387,Radioactive Man,Springfield Convention Center,"Sorry, Fallout Boy, not until you're sixteen.",sorry fallout boy not until youre sixteen,7
10034,34,40,Radioactive Man: Look out!,236000,true,484,387,Radioactive Man,Springfield Convention Center,Look out!,look out,2
10035,34,41,Announcer: Will Radioactive Man act in time to save the earth?,239000,true,33,387,Announcer,Springfield Convention Center,Will Radioactive Man act in time to save the earth?,will radioactive man act in time to save the earth,10
10036,34,42,"Convention Director: Well, wasn't that great?... Y'know, kids, I'm sure we'd all like to remember actor Dirk Richter for his portrayal of Radioactive Man, and not the sordid details of his final years, so let's keep the questions tasteful, okay? Now how about a big welcome for Buddy ""Fallout Boy"" Hodges!",245000,true,486,387,Convention Director,Springfield Convention Center,"Well, wasn't that great?... Y'know, kids, I'm sure we'd all like to remember actor Dirk Richter for his portrayal of Radioactive Man, and not the sordid details of his final years, so let's keep the questions tasteful, okay? Now how about a big welcome for Buddy ""Fallout Boy"" Hodges!",well wasnt that great yknow kids im sure wed all like to remember actor dirk richter for his portrayal of radioactive man and not the sordid details of his final years so lets keep the questions tasteful okay now how about a big welcome for buddy fallout boy hodges,49
10037,34,43,BUDDY: Any questions?,264000,true,487,387,BUDDY,Springfield Convention Center,Any questions?,any questions,2
10038,34,44,"Milhouse Van Houten: When Radioactive Man got injected with shrinking serum in issue two-thirty-four, how come his costume shrinks, too?",266000,true,25,387,Milhouse Van Houten,Springfield Convention Center,"When Radioactive Man got injected with shrinking serum in issue two-thirty-four, how come his costume shrinks, too?",when radioactive man got injected with shrinking serum in issue two-thirty-four how come his costume shrinks too,17
10039,34,45,"BUDDY: (PURSES LIPS) I am sure I don't know. But I did just finish playing Rum Tum Tugger in the second national touring company of ""Cats"" -- anybody see it?",272000,true,487,387,BUDDY,Springfield Convention Center,"I am sure I don't know. But I did just finish playing Rum Tum Tugger in the second national touring company of ""Cats"" -- anybody see it?",i am sure i dont know but i did just finish playing rum tum tugger in the second national touring company of cats -- anybody see it,27
10040,34,46,"Bart Simpson: (RAISING HAND, INTERRUPTING) Ooh. Ooh. Ooh. Ooh. Over here, Fallout Boy! Oh, oh, me... me... me... me, me.",279000,true,8,387,Bart Simpson,Springfield Convention Center,"Ooh. Ooh. Ooh. Ooh. Over here, Fallout Boy! Oh, oh, me... me... me... me, me.",ooh ooh ooh ooh over here fallout boy oh oh me me me me me,15
10041,34,47,"BUDDY: (POINTING TO BART) Yes, you, the masked boy.",281000,true,487,387,BUDDY,Springfield Convention Center,"Yes, you, the masked boy.",yes you the masked boy,5
10042,34,48,Bart Simpson: (EARNESTLY) Do you think the ghost of Dirk Richter haunts the bordello where his bullet-riddled body was found?,282000,true,8,387,Bart Simpson,Springfield Convention Center,Do you think the ghost of Dirk Richter haunts the bordello where his bullet-riddled body was found?,do you think the ghost of dirk richter haunts the bordello where his bullet-riddled body was found,17
10043,34,49,BUDDY: (UPSET) Dirk Richter was a beautiful man. Can't you little vultures leave him alone?,287000,true,487,387,BUDDY,Springfield Convention Center,Dirk Richter was a beautiful man. Can't you little vultures leave him alone?,dirk richter was a beautiful man cant you little vultures leave him alone,13
10044,34,50,"Nelson Muntz: Hey, Radioactive Man number seventy-two! It's the imaginary tale where Radioactive Man marries Larva Girl.",297000,true,101,387,Nelson Muntz,Springfield Convention Center,"Hey, Radioactive Man number seventy-two! It's the imaginary tale where Radioactive Man marries Larva Girl.",hey radioactive man number seventy-two its the imaginary tale where radioactive man marries larva girl,15
10046,34,52,Dealer: Tell you what. I'll show you something very special if you promise to put your grubby little hands behind your back and keep 'em there.,309000,true,488,387,Dealer,Springfield Convention Center,Tell you what. I'll show you something very special if you promise to put your grubby little hands behind your back and keep 'em there.,tell you what ill show you something very special if you promise to put your grubby little hands behind your back and keep em there,25
10047,34,53,Dealer: (OPENS PORTFOLIO) Behold!,317000,true,488,387,Dealer,Springfield Convention Center,Behold!,behold,1
10048,34,54,Bart Simpson: (QUIET AWE) Wow. Radioactive Man Number One.,318000,true,8,387,Bart Simpson,Springfield Convention Center,Wow. Radioactive Man Number One.,wow radioactive man number one,5
10049,34,55,Dealer: None other.,322000,true,488,387,Dealer,Springfield Convention Center,None other.,none other,2
10050,34,56,Bart Simpson: I bet it's worth a million bucks!,323000,true,8,387,Bart Simpson,Springfield Convention Center,I bet it's worth a million bucks!,i bet its worth a million bucks,7
10051,34,57,"Dealer: It is, my lad. But I'll let you have it for a hundred because you remind me of me.",324000,true,488,387,Dealer,Springfield Convention Center,"It is, my lad. But I'll let you have it for a hundred because you remind me of me.",it is my lad but ill let you have it for a hundred because you remind me of me,19
10052,34,58,Bart Simpson: (DISMAYED) All I got is thirty.,328000,true,8,387,Bart Simpson,Springfield Convention Center,All I got is thirty.,all i got is thirty,5
10053,34,59,Dealer: Then you cannot have it.,330000,true,488,387,Dealer,Springfield Convention Center,Then you cannot have it.,then you cannot have it,5
10054,34,60,"Bart Simpson: But I must. Until this moment, I never knew why God put me on this earth, but now I know... to buy that comic book.",331000,true,8,387,Bart Simpson,Springfield Convention Center,"But I must. Until this moment, I never knew why God put me on this earth, but now I know... to buy that comic book.",but i must until this moment i never knew why god put me on this earth but now i know to buy that comic book,25
10055,34,61,"Dealer: Your emotion is out of place here, son.",338000,true,488,387,Dealer,Springfield Convention Center,"Your emotion is out of place here, son.",your emotion is out of place here son,8
10056,34,62,(Simpson Car: int. simpson car - continuous),344000,false,,151,,Simpson Car,,,
10057,34,63,"Marge Simpson: So, did you kids have fun?",344000,true,1,151,Marge Simpson,Simpson Car,"So, did you kids have fun?",so did you kids have fun,6
10058,34,64,"Lisa Simpson: Yeah, Mom! Guess what? For a dollar a man sold me thirty-five Caspers and a dozen Lois Lanes.",346000,true,9,151,Lisa Simpson,Simpson Car,"Yeah, Mom! Guess what? For a dollar a man sold me thirty-five Caspers and a dozen Lois Lanes.",yeah mom guess what for a dollar a man sold me thirty-five caspers and a dozen lois lanes,18
10059,34,65,Marge Simpson: Ohhh.,351000,true,1,151,Marge Simpson,Simpson Car,Ohhh.,ohhh,1
10060,34,66,Homer Simpson: I never knew what Superman saw in her. Give me Wonder Woman! (GROWLS) And that golden lariat. She can tie me up any time. (BARKS) (HOWLS),351000,true,2,151,Homer Simpson,Simpson Car,I never knew what Superman saw in her. Give me Wonder Woman! And that golden lariat. She can tie me up any time.,i never knew what superman saw in her give me wonder woman and that golden lariat she can tie me up any time,23
10061,34,67,Marge Simpson: Homer!,365000,true,1,151,Marge Simpson,Simpson Car,Homer!,homer,1
10062,34,68,"Homer Simpson: I was just kidding, Marge. (CHANGING SUBJECT) Hey, what does everyone say to dinner at Krusty Burger? My treat!",366000,true,2,151,Homer Simpson,Simpson Car,"I was just kidding, Marge. Hey, what does everyone say to dinner at Krusty Burger? My treat!",i was just kidding marge hey what does everyone say to dinner at krusty burger my treat,17
10063,34,69,"Bart Simpson: (KISSING UP) All right, Homer. Whoa, you really are a sport, Dad, taking us out to a fine restaurant like Krusty Burger!",372000,true,8,151,Bart Simpson,Simpson Car,"All right, Homer. Whoa, you really are a sport, Dad, taking us out to a fine restaurant like Krusty Burger!",all right homer whoa you really are a sport dad taking us out to a fine restaurant like krusty burger,20
10064,34,70,"Homer Simpson: (SUSPICIOUS) All right, what are you getting at?",378000,true,2,151,Homer Simpson,Simpson Car,"All right, what are you getting at?",all right what are you getting at,7
10065,34,71,Bart Simpson: I need a hundred dollars for a comic book.,380000,true,8,151,Bart Simpson,Simpson Car,I need a hundred dollars for a comic book.,i need a hundred dollars for a comic book,9
10066,34,72,"Homer Simpson: A hundred bucks?! For a comic book? Who drew it, Micha-ma-langelo?",382000,true,2,151,Homer Simpson,Simpson Car,"A hundred bucks?! For a comic book? Who drew it, Micha-ma-langelo?",a hundred bucks for a comic book who drew it micha-ma-langelo,11
10067,34,73,"Bart Simpson: Oh please, Dad. I want this more than anything in the world.",384000,true,8,151,Bart Simpson,Simpson Car,"Oh please, Dad. I want this more than anything in the world.",oh please dad i want this more than anything in the world,12
10068,34,74,"Homer Simpson: Well, t.s.",388000,true,2,151,Homer Simpson,Simpson Car,"Well, t.s.",well ts,2
10069,34,75,(Krusty Burger: int. krusty burger - a little later),390000,false,,388,,Krusty Burger,,,
10070,34,76,Bart Simpson: Please Dad.,390000,true,8,388,Bart Simpson,Krusty Burger,Please Dad.,please dad,2
10071,34,77,Homer Simpson: No.,390000,true,2,388,Homer Simpson,Krusty Burger,No.,no,1
10072,34,78,Bart Simpson: Please Dad.,390000,true,8,388,Bart Simpson,Krusty Burger,Please Dad.,please dad,2
10073,34,79,Homer Simpson: No.,390000,true,2,388,Homer Simpson,Krusty Burger,No.,no,1
10074,34,80,Bart Simpson: Please Dad.,392000,true,8,388,Bart Simpson,Krusty Burger,Please Dad.,please dad,2
10075,34,81,Homer Simpson: No.,392000,true,2,388,Homer Simpson,Krusty Burger,No.,no,1
10076,34,82,Bart Simpson: Please Dad.,392000,true,8,388,Bart Simpson,Krusty Burger,Please Dad.,please dad,2
10077,34,83,Homer Simpson: No.,392000,true,2,388,Homer Simpson,Krusty Burger,No.,no,1
10078,34,84,Bart Simpson: Please Dad.,392000,true,8,388,Bart Simpson,Krusty Burger,Please Dad.,please dad,2
10079,34,85,Homer Simpson: No.,392000,true,2,388,Homer Simpson,Krusty Burger,No.,no,1
10086,34,92,Bart Simpson: Please Dad.,395000,true,8,388,Bart Simpson,Krusty Burger,Please Dad.,please dad,2
10087,34,93,Homer Simpson: No.,395000,true,2,388,Homer Simpson,Krusty Burger,No.,no,1
10088,34,94,Bart Simpson: Please Dad.,395000,true,8,388,Bart Simpson,Krusty Burger,Please Dad.,please dad,2
10089,34,95,Homer Simpson: No.,395000,true,2,388,Homer Simpson,Krusty Burger,No.,no,1
10090,34,96,Bart Simpson: Please Dad.,395000,true,8,388,Bart Simpson,Krusty Burger,Please Dad.,please dad,2
10091,34,97,"Homer Simpson: (SHOUTING) No! (KINDLY) Now, look, son, we all know that usually when you bug me like this, I give in, so I'm not mad at you for trying. It shows you've been paying attention. But we all know I'm not gonna give you a hundred dollars. Now are you gonna stop bugging me?",396000,true,2,388,Homer Simpson,Krusty Burger,"No! Now, look, son, we all know that usually when you bug me like this, I give in, so I'm not mad at you for trying. It shows you've been paying attention. But we all know I'm not gonna give you a hundred dollars. Now are you gonna stop bugging me?",no now look son we all know that usually when you bug me like this i give in so im not mad at you for trying it shows youve been paying attention but we all know im not gonna give you a hundred dollars now are you gonna stop bugging me,51
10092,34,98,Bart Simpson: No.,410000,true,8,388,Bart Simpson,Krusty Burger,No.,no,1
10093,34,99,Homer Simpson: Are you?,410000,true,2,388,Homer Simpson,Krusty Burger,Are you?,are you,2
10094,34,100,Bart Simpson: No.,410000,true,8,388,Bart Simpson,Krusty Burger,No.,no,1
10095,34,101,Homer Simpson: Are you?,410000,true,2,388,Homer Simpson,Krusty Burger,Are you?,are you,2
10096,34,102,Bart Simpson: No.,410000,true,8,388,Bart Simpson,Krusty Burger,No.,no,1
10097,34,103,Homer Simpson: Are you?,410000,true,2,388,Homer Simpson,Krusty Burger,Are you?,are you,2
10098,34,104,Bart Simpson: No.,411000,true,8,388,Bart Simpson,Krusty Burger,No.,no,1
10099,34,105,Homer Simpson: Are you?,411000,true,2,388,Homer Simpson,Krusty Burger,Are you?,are you,2
10100,34,106,Bart Simpson: No.,411000,true,8,388,Bart Simpson,Krusty Burger,No.,no,1
10101,34,107,Homer Simpson: Are you?,411000,true,2,388,Homer Simpson,Krusty Burger,Are you?,are you,2
10102,34,108,Bart Simpson: No.,411000,true,8,388,Bart Simpson,Krusty Burger,No.,no,1
10103,34,109,Homer Simpson: Are you?,411000,true,2,388,Homer Simpson,Krusty Burger,Are you?,are you,2
10104,34,110,Bart Simpson: No.,411000,true,8,388,Bart Simpson,Krusty Burger,No.,no,1
10105,34,111,Homer Simpson: Are you?,413000,true,2,388,Homer Simpson,Krusty Burger,Are you?,are you,2
10106,34,112,Bart Simpson: No.,413000,true,8,388,Bart Simpson,Krusty Burger,No.,no,1
10107,34,113,Homer Simpson: Are you?,413000,true,2,388,Homer Simpson,Krusty Burger,Are you?,are you,2
10108,34,114,Bart Simpson: No.,413000,true,8,388,Bart Simpson,Krusty Burger,No.,no,1
10109,34,115,Homer Simpson: Are you?,413000,true,2,388,Homer Simpson,Krusty Burger,Are you?,are you,2
10110,34,116,Bart Simpson: No.,413000,true,8,388,Bart Simpson,Krusty Burger,No.,no,1
10111,34,117,Homer Simpson: Are you?,413000,true,2,388,Homer Simpson,Krusty Burger,Are you?,are you,2
10112,34,118,"Bart Simpson: (AFTER A PAUSE, SCREAMING) Okay.",415000,true,8,388,Bart Simpson,Krusty Burger,Okay.,okay,1
10113,34,119,"Homer Simpson: (GLOATING) Hee hee, I win! In your face! Yeah! How do you like them apples? Woo hoo hoo!",416000,true,2,388,Homer Simpson,Krusty Burger,"Hee hee, I win! In your face! Yeah! How do you like them apples? Woo hoo hoo!",hee hee i win in your face yeah how do you like them apples woo hoo hoo,17
10114,34,120,"Marge Simpson: Don't gloat, Homer. (TO BART) You know, Bart, when I was your age, the one thing I wanted more than anything in the world was a Child-sized Electric Lightbulb Oven. My parents wouldn't give me the money, so I went to my sisters, Patty and Selma...",422000,true,1,388,Marge Simpson,Krusty Burger,"Don't gloat, Homer. You know, Bart, when I was your age, the one thing I wanted more than anything in the world was a Child-sized Electric Lightbulb Oven. My parents wouldn't give me the money, so I went to my sisters, Patty and Selma...",dont gloat homer you know bart when i was your age the one thing i wanted more than anything in the world was a child-sized electric lightbulb oven my parents wouldnt give me the money so i went to my sisters patty and selma,44
10115,34,121,(Bouvier House: int. bouvier house - sisters' room - 1963),435000,false,,389,,Bouvier House,,,
10116,34,122,Young Patty: (TO MARGE) We'll give you half our allowance.,435000,true,489,389,Young Patty,Bouvier House,We'll give you half our allowance.,well give you half our allowance,6
10117,34,123,Young Selma: Uh-huh. But you have to be our slave.,436000,true,490,389,Young Selma,Bouvier House,Uh-huh. But you have to be our slave.,uh-huh but you have to be our slave,8
10119,34,125,Young Patty: (TO SELMA) This gives us a lot more free time.,440000,true,489,389,Young Patty,Bouvier House,This gives us a lot more free time.,this gives us a lot more free time,8
10120,34,126,Young Selma: Uh-huh. Let's take up smoking.,440000,true,490,389,Young Selma,Bouvier House,Uh-huh. Let's take up smoking.,uh-huh lets take up smoking,5
10121,34,127,"Marge Simpson: For months, I worked and worked, while my sisters smoked and smoked...",444000,true,1,389,Marge Simpson,Bouvier House,"For months, I worked and worked, while my sisters smoked and smoked...",for months i worked and worked while my sisters smoked and smoked,12
10122,34,128,"Older Patty: (SINGING ALONG) Venus... Oh, Venus...",449000,true,492,389,Older Patty,Bouvier House,"Venus... Oh, Venus...",venus oh venus,3
10123,34,129,Older Selma: (TO MARGE) We want those dress-shields hand-washed and drip-dried.,455000,true,493,389,Older Selma,Bouvier House,We want those dress-shields hand-washed and drip-dried.,we want those dress-shields hand-washed and drip-dried,7
10158,34,164,Nelson Muntz: Haw haw!,559000,true,101,5,Nelson Muntz,Simpson Home,Haw haw!,haw haw,2
10222,34,228,Mrs. Glick: Here we are.,804000,true,496,395,Mrs. Glick,GLICK HOUSE,Here we are.,here we are,3
10124,34,130,"Marge Simpson: But the big day finally came. And because I'd worked for it, all those lightbulb-warmed treats always tasted extra-good.",461000,true,1,389,Marge Simpson,Bouvier House,"But the big day finally came. And because I'd worked for it, all those lightbulb-warmed treats always tasted extra-good.",but the big day finally came and because id worked for it all those lightbulb-warmed treats always tasted extra-good,19
10125,34,131,(Krusty Burger: int. krusty burger - continuous),469000,false,,388,,Krusty Burger,,,
10126,34,132,Marge Simpson: So maybe a part-time job is the answer.,469000,true,1,388,Marge Simpson,Krusty Burger,So maybe a part-time job is the answer.,so maybe a part-time job is the answer,8
10127,34,133,"Bart Simpson: Aw, Mom, I couldn't ask you to do that. You're already taking care of Maggie, and Lisa is such a handful --",472000,true,8,388,Bart Simpson,Krusty Burger,"Aw, Mom, I couldn't ask you to do that. You're already taking care of Maggie, and Lisa is such a handful --",aw mom i couldnt ask you to do that youre already taking care of maggie and lisa is such a handful --,22
10128,34,134,"Lisa Simpson: She means you should get a job, stupid.",477000,true,9,388,Lisa Simpson,Krusty Burger,"She means you should get a job, stupid.",she means you should get a job stupid,8
10129,34,135,Bart Simpson: Me?,479000,true,8,388,Bart Simpson,Krusty Burger,Me?,me,1
10130,34,136,"Adult Narrator: Get a job! Were they serious? I didn't realize it at the time, but a little piece of my childhood had slipped away... forever.",481000,true,494,388,Adult Narrator,Krusty Burger,"Get a job! Were they serious? I didn't realize it at the time, but a little piece of my childhood had slipped away... forever.",get a job were they serious i didnt realize it at the time but a little piece of my childhood had slipped away forever,24
10131,34,137,Homer Simpson: Bart! What are you staring at?,491000,true,2,388,Homer Simpson,Krusty Burger,Bart! What are you staring at?,bart what are you staring at,6
10132,34,138,Bart Simpson: Uh... nothing.,492000,true,8,388,Bart Simpson,Krusty Burger,Uh... nothing.,uh nothing,2
10133,34,139,"Adult Narrator: He didn't say it, and neither did I, but at that moment my dad and I were closer than we ever...",494000,true,494,388,Adult Narrator,Krusty Burger,"He didn't say it, and neither did I, but at that moment my dad and I were closer than we ever...",he didnt say it and neither did i but at that moment my dad and i were closer than we ever,21
